<?xml version="1.0" encoding="UTF-8"?>
<gelCAN:referrals xmlns:vc="http://www.w3.org/2007/XMLSchema-versioning"
 xmlns:gelCAN="https://genomicsengland.co.uk/xsd/cancer/2.0.0"
 xmlns:xsi="http://www.w3.org/2001/XMLSchema-instance"
 xsi:schemaLocation="https://genomicsengland.co.uk/xsd/cancer/2.0.0 file:/Users/genomicsengland/Documents/Cancer/MainProgrammeCancer/Cancer%20Schemas%20v2.0.0%20FINAL/ReferralsCancer-v2.0.0.xsd">
    <gelCAN:metadata>
        <gelCAN:schema-name>ReferralsCancer</gelCAN:schema-name>
        <gelCAN:schema-version>2.0.0</gelCAN:schema-version>
        <gelCAN:date>2006-05-04</gelCAN:date>
        <gelCAN:source-organisation>source-organisation0</gelCAN:source-organisation>
        <gelCAN:source-system>source-system0</gelCAN:source-system>
        <gelCAN:local-report-id>local-report-id0</gelCAN:local-report-id>
    </gelCAN:metadata>
    <gelCAN:subject>
        <gelCAN:participant-identifiers>
            <gelCAN:participant-id>participant-id0</gelCAN:participant-id>
            <gelCAN:date-of-birth>2006-05-04</gelCAN:date-of-birth>
            <gelCAN:nhs-number>0000000000</gelCAN:nhs-number>
            <gelCAN:chi-number>chi-number0</gelCAN:chi-number>
            <gelCAN:surname>surname0</gelCAN:surname>
            <gelCAN:forenames>forenames0</gelCAN:forenames>
        </gelCAN:participant-identifiers>
        <gelCAN:referral>
            <gelCAN:event-details>
                <gelCAN:event-date>2006-05-04T18:13:51.0</gelCAN:event-date>
                <gelCAN:event-reference>event-reference0</gelCAN:event-reference>
            </gelCAN:event-details>
            <gelCAN:consultant-details>
                <gelCAN:full-name-of-responsible-consultant>full-name-of-responsible-consultant0</gelCAN:full-name-of-responsible-consultant>
                <gelCAN:consultant-gmc-number>consultant-gmc-number0</gelCAN:consultant-gmc-number>
                <gelCAN:full-name-not-consultant>full-name-not-consultant0</gelCAN:full-name-not-consultant>
                <gelCAN:contact-number>contact-number0</gelCAN:contact-number>
                <gelCAN:hospital-of-responsible-consultant>hospital-of-responsible-consultant0</gelCAN:hospital-of-responsible-consultant>
            </gelCAN:consultant-details>
            <gelCAN:date-first-seen>2006-05-04</gelCAN:date-first-seen>
            <gelCAN:presentation>abdominal_symptoms</gelCAN:presentation>
            <gelCAN:presentation>abdominal_symptoms</gelCAN:presentation>
        </gelCAN:referral>
        <gelCAN:referral>
            <gelCAN:event-details>
                <gelCAN:event-date>2006-05-04T18:13:51.0</gelCAN:event-date>
                <gelCAN:event-reference>event-reference1</gelCAN:event-reference>
            </gelCAN:event-details>
            <gelCAN:consultant-details>
                <gelCAN:full-name-of-responsible-consultant>full-name-of-responsible-consultant1</gelCAN:full-name-of-responsible-consultant>
                <gelCAN:consultant-gmc-number>consultant-gmc-number1</gelCAN:consultant-gmc-number>
                <gelCAN:full-name-not-consultant>full-name-not-consultant1</gelCAN:full-name-not-consultant>
                <gelCAN:contact-number>contact-number1</gelCAN:contact-number>
                <gelCAN:hospital-of-responsible-consultant>hospital-of-responsible-consultant1</gelCAN:hospital-of-responsible-consultant>
            </gelCAN:consultant-details>
            <gelCAN:date-first-seen>2006-05-04</gelCAN:date-first-seen>
            <gelCAN:presentation>abdominal_symptoms</gelCAN:presentation>
            <gelCAN:presentation>abdominal_symptoms</gelCAN:presentation>
        </gelCAN:referral>
    </gelCAN:subject>
    <gelCAN:subject>
        <gelCAN:participant-identifiers>
            <gelCAN:participant-id>participant-id1</gelCAN:participant-id>
            <gelCAN:date-of-birth>2006-05-04</gelCAN:date-of-birth>
            <gelCAN:nhs-number>0000000000</gelCAN:nhs-number>
            <gelCAN:chi-number>chi-number1</gelCAN:chi-number>
            <gelCAN:surname>surname1</gelCAN:surname>
            <gelCAN:forenames>forenames1</gelCAN:forenames>
        </gelCAN:participant-identifiers>
        <gelCAN:referral>
            <gelCAN:event-details>
                <gelCAN:event-date>2006-05-04T18:13:51.0</gelCAN:event-date>
                <gelCAN:event-reference>event-reference2</gelCAN:event-reference>
            </gelCAN:event-details>
            <gelCAN:consultant-details>
                <gelCAN:full-name-of-responsible-consultant>full-name-of-responsible-consultant2</gelCAN:full-name-of-responsible-consultant>
                <gelCAN:consultant-gmc-number>consultant-gmc-number2</gelCAN:consultant-gmc-number>
                <gelCAN:full-name-not-consultant>full-name-not-consultant2</gelCAN:full-name-not-consultant>
                <gelCAN:contact-number>contact-number2</gelCAN:contact-number>
                <gelCAN:hospital-of-responsible-consultant>hospital-of-responsible-consultant2</gelCAN:hospital-of-responsible-consultant>
            </gelCAN:consultant-details>
            <gelCAN:date-first-seen>2006-05-04</gelCAN:date-first-seen>
            <gelCAN:presentation>abdominal_symptoms</gelCAN:presentation>
            <gelCAN:presentation>abdominal_symptoms</gelCAN:presentation>
        </gelCAN:referral>
        <gelCAN:referral>
            <gelCAN:event-details>
                <gelCAN:event-date>2006-05-04T18:13:51.0</gelCAN:event-date>
                <gelCAN:event-reference>event-reference3</gelCAN:event-reference>
            </gelCAN:event-details>
            <gelCAN:consultant-details>
                <gelCAN:full-name-of-responsible-consultant>full-name-of-responsible-consultant3</gelCAN:full-name-of-responsible-consultant>
                <gelCAN:consultant-gmc-number>consultant-gmc-number3</gelCAN:consultant-gmc-number>
                <gelCAN:full-name-not-consultant>full-name-not-consultant3</gelCAN:full-name-not-consultant>
                <gelCAN:contact-number>contact-number3</gelCAN:contact-number>
                <gelCAN:hospital-of-responsible-consultant>hospital-of-responsible-consultant3</gelCAN:hospital-of-responsible-consultant>
            </gelCAN:consultant-details>
            <gelCAN:date-first-seen>2006-05-04</gelCAN:date-first-seen>
            <gelCAN:presentation>abdominal_symptoms</gelCAN:presentation>
            <gelCAN:presentation>abdominal_symptoms</gelCAN:presentation>
        </gelCAN:referral>
    </gelCAN:subject>
</gelCAN:referrals>
